{
  "schema_version": "1.0.0",
  "event_id": "evt:configuration-synthetic-001",
  "event_type": "configuration_evidence_observed",
  "source_instance_id": "src:codex-rollout-synthetic-001",
  "safe_cursor_id": "cursor:codex-rollout-synthetic-001",
  "event_at": "2026-10-03T10:00:02Z",
  "session_id": "session:codex-rollout-synthetic-001",
  "task_id": "task:codex-rollout-synthetic-001",
  "payload": {
    "kind": "configuration",
    "configuration": {
      "plan": {
        "availability": "unavailable",
        "provenance": "unavailable"
      },
      "model": {
        "availability": "available",
        "value": "gpt-synthetic",
        "provenance": "observed"
      },
      "reasoning_level": {
        "availability": "available",
        "value": "medium",
        "provenance": "observed"
      },
      "speed_mode": {
        "availability": "unavailable",
        "provenance": "unavailable"
      },
      "codex_version": {
        "availability": "available",
        "value": "0.157.1",
        "provenance": "observed"
      }
    }
  }
}
